{
  "metadata": {
    "scenario_id": "2007-11",
    "date": "2007-11-30",
    "display_date": "November 30, 2007",
    "data_kind": "historical",
    "selection": {
      "mode": "random",
      "draw_universe": "calendar-month-ends-1980-2020-expansion-50-v1",
      "random_seed": "simple-long-term-investing-game/50-scenarios/2026-10-06",
      "draw_index": 9,
      "method": "Preregistered FNV-1a/Mulberry32 unbiased draws without replacement from eligible month ends. Preserves six pilots; no outcome screening.",
      "exclusions": [
        "Exact duplicates of reserved important dates and retained random pilot dates",
        "Genuine source or return-history unavailability only"
      ],
      "replacement_for": null
    }
  },
  "headlines": [
    {
      "headline": "Pakistan’s political crisis deepens",
      "category": "World",
      "summary": "Benazir Bhutto breaks with Pervez Musharraf after emergency rule. The path toward elections remains disputed.",
      "selection_note": "Selected for contemporary relevance and topic balance, before researching new outcome windows.",
      "source_ids": ["news-2007-11-6"]
    },
    {
      "headline": "Astronomers find more planets beyond our solar system",
      "category": "Science",
      "summary": "A fifth planet is detected around 55 Cancri. Better methods are revealing more distant worlds.",
      "selection_note": "Selected for contemporary relevance and topic balance, before researching new outcome windows.",
      "source_ids": ["news-2007-11-7"]
    },
    {
      "headline": "Driverless cars compete in a robot challenge",
      "category": "Technology",
      "summary": "Teams test vehicles that navigate without a person at the wheel. The competition exposes both progress and remaining difficulties.",
      "selection_note": "Selected for contemporary relevance and topic balance, before researching new outcome windows.",
      "source_ids": ["news-2007-11-10"]
    },
    {
      "headline": "Georgia’s drought raises questions about water use",
      "category": "Environment",
      "summary": "A severe drought prompts debate over development, farming and conservation.",
      "selection_note": "Selected for contemporary relevance and topic balance, before researching new outcome windows.",
      "source_ids": ["news-2007-11-11"]
    },
    {
      "headline": "Retirement communities offer new choices",
      "category": "Everyday life",
      "summary": "Some communities add more activities and different ways to live as people plan longer retirements.",
      "selection_note": "Selected for contemporary relevance and topic balance, before researching new outcome windows.",
      "source_ids": ["news-2007-11-21"]
    },
    {
      "headline": "India’s tea growers face changing markets",
      "category": "Business",
      "summary": "Producers balance global competition, consumer tastes and the cost of growing and harvesting tea.",
      "selection_note": "Selected for contemporary relevance and topic balance, before researching new outcome windows.",
      "source_ids": ["news-2007-11-35"]
    },
    {
      "headline": "Amazon introduces Kindle",
      "category": "Technology",
      "summary": "The portable reader downloads books wirelessly. The company hopes readers will adopt a new way to buy and read.",
      "selection_note": "Contemporary context selected before outcome retrieval.",
      "source_ids": ["kindle-launch"]
    },
    {
      "headline": "Citigroup changes leadership after mortgage losses",
      "category": "Economy",
      "summary": "Charles Prince steps down. The bank appoints temporary leadership and begins a search for a new chief executive.",
      "selection_note": "Contemporary context selected before outcome retrieval.",
      "source_ids": ["citi-leadership"]
    }
  ],
  "macro": [
    {
      "label": "Prices: rise over one year (2007-10; approximate)",
      "value": 3.6,
      "unit": "%",
      "source_ids": ["asof-macro-cpiaucsl"]
    },
    {
      "label": "People seeking work without a job (2007-10; approximate)",
      "value": 4.7,
      "unit": "%",
      "source_ids": ["asof-macro-unrate"]
    },
    {
      "label": "Short-term US interest rate (2007-10; approximate)",
      "value": 4.8,
      "unit": "%",
      "source_ids": ["asof-macro-fedfunds"]
    },
    {
      "label": "10-year US government bond yield (2007-10; approximate)",
      "value": 4.5,
      "unit": "%",
      "source_ids": ["asof-macro-gs10"]
    },
    {
      "label": "Consumer confidence (2007-10; approximate)",
      "value": 80.9,
      "unit": "index (1966 = 100)",
      "source_ids": ["asof-macro-umcsent"]
    },
    {
      "label": "Industrial output: change over one year (2007-10; approximate)",
      "value": 2.6,
      "unit": "%",
      "source_ids": ["asof-macro-indpro"]
    }
  ],
  "forecasts": [
    {
      "text": "The latest quarterly survey’s middle forecast expects about 2.2% growth for the quarter after that survey, at an annual pace. That means the pace if one quarter’s change lasted a year; it is a forecast, not a guarantee.",
      "source_ids": ["spf-outlook"]
    }
  ],
  "hot_stocks": [
    {
      "id": "hot:2007-11:amazon",
      "company_name": "Amazon.com",
      "ticker": "AMZN",
      "description": "The online retailer has introduced Kindle, a device for reading downloaded books.",
      "selection_rationale": "Selected from pre-cutoff company coverage and current public attention; no future performance used.",
      "source_ids": ["kindle-launch", "asof-stock-prices"],
      "three_month": 0.1332748788633149,
      "one_year": 1.2449181793992863
    },
    {
      "id": "hot:2007-11:citigroup",
      "company_name": "Citigroup",
      "ticker": "C",
      "description": "Its chief executive is leaving after large losses linked to mortgage investments.",
      "selection_rationale": "Selected from pre-cutoff company coverage and current public attention; no future performance used.",
      "source_ids": ["citi-leadership", "asof-stock-prices"],
      "three_month": -0.28040169566020356,
      "one_year": -0.29800507762195516
    },
    {
      "id": "hot:2007-11:apple",
      "company_name": "Apple",
      "ticker": "AAPL",
      "description": "The company has entered the mobile-phone market with the iPhone.",
      "selection_rationale": "Selected from pre-cutoff company coverage and current public attention; no future performance used.",
      "source_ids": ["iphone-retail", "asof-stock-prices"],
      "three_month": 0.31585829459067116,
      "one_year": 0.9879995672573854
    }
  ],
  "asset_definitions": [
    {
      "id": "cash",
      "name": "Cash",
      "description": "Short-term US government bills: interest-bearing cash, not banknotes.",
      "source_ids": ["asof-broad-proxies"]
    },
    {
      "id": "bonds",
      "name": "Bonds",
      "description": "Loans to the US government. This example uses an intermediate-term Treasury estimate.",
      "source_ids": ["asof-broad-proxies"]
    },
    {
      "id": "us_total",
      "name": "US Total Market",
      "description": "Small pieces of many US companies, with dividends included.",
      "source_ids": ["asof-broad-proxies"]
    },
    {
      "id": "international_ex_us",
      "name": "International ex-US",
      "description": "Shares in developed-market companies outside the US, measured in dollars.",
      "source_ids": ["asof-broad-proxies"]
    },
    {
      "id": "hot:2007-11:amazon",
      "name": "Amazon.com",
      "description": "The online retailer has introduced Kindle, a device for reading downloaded books.",
      "source_ids": ["kindle-launch", "asof-stock-prices"]
    },
    {
      "id": "hot:2007-11:citigroup",
      "name": "Citigroup",
      "description": "Its chief executive is leaving after large losses linked to mortgage investments.",
      "source_ids": ["citi-leadership", "asof-stock-prices"]
    },
    {
      "id": "hot:2007-11:apple",
      "name": "Apple",
      "description": "The company has entered the mobile-phone market with the iPhone.",
      "source_ids": ["iphone-retail", "asof-stock-prices"]
    }
  ],
  "recent_returns": [
    {
      "asset_id": "cash",
      "three_month": 0.009832034816000146,
      "one_year": 0.048024724237063054,
      "source_ids": ["asof-broad-proxies"]
    },
    {
      "asset_id": "bonds",
      "three_month": 0.045227048494744126,
      "one_year": 0.08949533287343825,
      "source_ids": ["asof-broad-proxies"]
    },
    {
      "asset_id": "us_total",
      "three_month": 0.010093726475999931,
      "one_year": 0.07705849042908164,
      "source_ids": ["asof-broad-proxies"]
    },
    {
      "asset_id": "international_ex_us",
      "three_month": 0.05799936624199997,
      "one_year": 0.1824387100783167,
      "source_ids": ["asof-broad-proxies"]
    }
  ]
}
